{
  "schemaVersion":"1",
  "suiteId":"R3-A256GCM-CHUNKED-HPKE-X25519-HKDF256-A128GCM-ED25519",
  "chainId":"2026072901",
  "authorizationContract":"0x9ef44cf538d0df457ba77c556d8785e48bfc436d",
  "headerRegistry":"0x0000000000000000000000000000000000000001",
  "resourceId":"0x1111111111111111111111111111111111111111111111111111111111111111",
  "bodyReference":"local://objects/sha256/example",
  "bodyDigest":"0x2222222222222222222222222222222222222222222222222222222222222222",
  "bodyVersion":"1",
  "policyDigest":"0x3333333333333333333333333333333333333333333333333333333333333333",
  "epoch":"2",
  "stateVersion":"2",
  "headerVersion":"1",
  "keyVersion":"1",
  "previousHeaderDigest":"0x0000000000000000000000000000000000000000000000000000000000000000",
  "bodyFormat":{"formatVersion":"1","chunkSize":"4194304","chunkCount":"1","plaintextLength":"1024","nonceBase":"AAAAAAAAAAA"},
  "recipientEnvelopes":[{
    "recipientKeyId":"0x4444444444444444444444444444444444444444444444444444444444444444",
    "userVersion":"1",
    "encapsulation":"AAAAAAAAAAAAAAAAAAAAAAAAAAAAAAAAAAAAAAAAAAA",
    "wrappedKey":"AAAAAAAAAAAAAAAAAAAAAAAAAAAAAAAAAAAAAAAAAAAAAAAAAAAAAAAAAAAAAAAA"
  }],
  "createdAt":"2026-07-29T08:00:00Z",
  "issuerId":"epoch-auth-issuer-r3",
  "metadataDigest":"0x0000000000000000000000000000000000000000000000000000000000000000",
  "issuerSignature":"AAAAAAAAAAAAAAAAAAAAAAAAAAAAAAAAAAAAAAAAAAAAAAAAAAAAAAAAAAAAAAAAAAAAAAAAAAAAAAAAAAAAAA"
}
